{"activated_at":"2026-09-26T16:03:43Z","activated_from_proposal_id":null,"candidate_head_sha":"ec989da1e972283e4b5f6748b83dfa28a72c379a","effect_lineage_id":"lin-d58568b58c33e5a9f09b467de43d9b65f69e4d60f1506719","expected_revision":1,"external_dispatch_key":"dispatch-668b2f2455248d53f8be5cca22dbe56caa7aef6f","operation_generation_at_activation":0,"operation_id_at_activation":"op-91bcb2f91adb0a403a86c6b371f23b684cdf21b5","predecessor_semantic_effect_key":null,"role":"reviewer","schema_version":"ai-sdlc.effect-lineage-member/v1","semantic_effect_key":"20196dceb23c354419ad6fe4412864d4ce998654eba5da1e4fdc67cc93519bc8","stage":"code-review","task_identity":"vertical:code-review:ec989da1e972283e4b5f6748b83dfa28a72c379a","trusted_context_digest":"ddb2679d296897871ac741e5d98ded4440b76cbaa1fcb7b419e687cab8281684"}
