{"activated_at":"2026-09-28T15:41:40Z","activated_from_proposal_id":null,"candidate_head_sha":"293eec055ec9bcc686fd73ca75a125f76b24f34a","effect_lineage_id":"lin-71b21b391f5da938e56b9fb891f56ef537327e199768e8fc","expected_revision":1,"external_dispatch_key":"dispatch-751ddb97b6a6d1950b7ad0fc73a826184eb4da78","operation_generation_at_activation":0,"operation_id_at_activation":"op-486399a9269119d7a72959a524e6c4d4fdc54dcb","predecessor_semantic_effect_key":null,"role":"reviewer","schema_version":"ai-sdlc.effect-lineage-member/v1","semantic_effect_key":"ed7ca1cf1283498db792fb011aefb82adba1fa6acdd9982a72cc8bd8e79da21f","stage":"code-review","task_identity":"vertical:code-review:293eec055ec9bcc686fd73ca75a125f76b24f34a","trusted_context_digest":"8f903a10926432abe28c8e4b667a3a3e9d6c9d872419967108750ec346414107"}
