{"activated_at":"2026-10-02T09:16:16Z","activated_from_proposal_id":null,"candidate_head_sha":"3cacb2d542f2cd0ca69f7e64ee712fa1186b26af","effect_lineage_id":"lin-d3a92aaac920657d9c4f754bcdbbe6abcb4e90968f57369d","expected_revision":1,"external_dispatch_key":"dispatch-a2f800a1eccaddcbfe5b91a8190446e8f80d3dae","operation_generation_at_activation":0,"operation_id_at_activation":"op-f84597e8a650cc1400d9ab13a42a9615fc1bab53","predecessor_semantic_effect_key":null,"role":"reviewer","schema_version":"ai-sdlc.effect-lineage-member/v1","semantic_effect_key":"b8e95292056354ad46ab35e1b8da03c7043df8ecbf36d27c62e21f262c8936b4","stage":"code-review","task_identity":"vertical:code-review:3cacb2d542f2cd0ca69f7e64ee712fa1186b26af","trusted_context_digest":"46fd1b6f1d888a66a38f96d78b0dd7b9c4a31857913f914f83a23b4fec7fb121"}
