{"activated_at":"2026-09-27T11:08:53Z","activated_from_proposal_id":null,"candidate_head_sha":"f9efb72d5b9e1cd5e88ac7cf9636a56daeef0d49","effect_lineage_id":"lin-c40f99705d92538ca84fe715c3aa1b136574e22a0fc7de2c","expected_revision":3,"external_dispatch_key":"dispatch-24f0f3d1f6eb9d9a141ac2e495565df18afb2930","operation_generation_at_activation":1,"operation_id_at_activation":"op-9ca08f41b72a3bd7ae231d9662bfea85a9d54c27","predecessor_semantic_effect_key":null,"role":"qa","schema_version":"ai-sdlc.effect-lineage-member/v1","semantic_effect_key":"7bbabc1c36f6ade6ecfcadc97986ea14074454a98489022df56e65c4ff8290c9","stage":"verification","task_identity":"vertical:verification:f9efb72d5b9e1cd5e88ac7cf9636a56daeef0d49","trusted_context_digest":"30aa6094a3e3933e72b201f982c9c78f93c79ca62b28cfdfecd09b59860d9904"}
