{"activated_at":"2026-09-27T10:37:44Z","activated_from_proposal_id":null,"candidate_head_sha":"f7d1cb4f5c6719c6f87933007434a78ce13875c2","effect_lineage_id":"lin-4d71a82dd195c4e762b68c27cb2d4cfe610665124f9076a1","expected_revision":1,"external_dispatch_key":"dispatch-5f5ad0ae9bd9570a21c20b0f9880ce97af35147f","operation_generation_at_activation":0,"operation_id_at_activation":"op-345c3c1fb5ebcf1e9306d744b49985e3a6bfaa0e","predecessor_semantic_effect_key":null,"role":"reviewer","schema_version":"ai-sdlc.effect-lineage-member/v1","semantic_effect_key":"a2b8127966309d19e190d4415844d4ae41509d3432fb61dc72a4d779228bb514","stage":"code-review","task_identity":"vertical:code-review:f7d1cb4f5c6719c6f87933007434a78ce13875c2","trusted_context_digest":"9c71e8e93c134954ad26718b161364bf74160272c574638019e002d71e297881"}
