{"activated_at":"2026-09-29T07:30:41Z","activated_from_proposal_id":null,"candidate_head_sha":"9639fe2faf765c3c9a3ae0a54dc777481a6ea86b","effect_lineage_id":"lin-3df2eabbf74abadf16c4e08c02e568e0e77e15d38980c30d","expected_revision":1,"external_dispatch_key":"dispatch-62a1cf94733be623b3e5c3a0be84bc78f6f77faa","operation_generation_at_activation":0,"operation_id_at_activation":"op-eb444c7ff0a27affef534f680fb6d106b3654362","predecessor_semantic_effect_key":null,"role":"reviewer","schema_version":"ai-sdlc.effect-lineage-member/v1","semantic_effect_key":"916f6b349d987457518f6fd5de53dea834a93418372d9761659e3111ab228f0e","stage":"code-review","task_identity":"vertical:code-review:9639fe2faf765c3c9a3ae0a54dc777481a6ea86b","trusted_context_digest":"8fabfd42106a284b6a83b23a1979d22bbc8a44292d8d51c9fd5c2824fea616e6"}
