{"activated_at":"2026-10-02T09:55:24Z","activated_from_proposal_id":null,"candidate_head_sha":"f1c74e82a6caae16341fe716ced4d91345a2a1b4","effect_lineage_id":"lin-dc76fa8a930caf89bb763a6528ae42bae8501aaaf70e69ae","expected_revision":3,"external_dispatch_key":"dispatch-d73cbcb1442b0f5359cb8a2dfd80a266294b1fb5","operation_generation_at_activation":1,"operation_id_at_activation":"op-e0b821c7a9dd2a887fe60a8ba7eb829b4982dd45","predecessor_semantic_effect_key":null,"role":"qa","schema_version":"ai-sdlc.effect-lineage-member/v1","semantic_effect_key":"042a0769a98c7d00a3702817fd6d9c9464270974b74f5658848ff3d4bdafc7a1","stage":"verification","task_identity":"vertical:verification:f1c74e82a6caae16341fe716ced4d91345a2a1b4","trusted_context_digest":"5419130cafaeb9262d16991761584217cc24846b25de3cd3040c989b6ff16bff"}
