{"activated_at":"2026-09-27T08:03:09Z","activated_from_proposal_id":null,"candidate_head_sha":"91d1f414a2e08ae69050a9deafcc369502c4a788","effect_lineage_id":"lin-dcb3556378fd1633dfb426b16f3139a4970cbbd675e897e0","expected_revision":1,"external_dispatch_key":"dispatch-d62f52db3a0c92e1e74a9095a6ab3c0db070eec1","operation_generation_at_activation":0,"operation_id_at_activation":"op-50a892e35bc4a66bfb88eaac4ca72c39846c578a","predecessor_semantic_effect_key":null,"role":"reviewer","schema_version":"ai-sdlc.effect-lineage-member/v1","semantic_effect_key":"bfa22cb0a77c449d7cde62ff539869eacfa881904b9fc5d5663a0276fce9d4e7","stage":"code-review","task_identity":"vertical:code-review:91d1f414a2e08ae69050a9deafcc369502c4a788","trusted_context_digest":"2f603555b155ad12823c602a71e7416e4d8bdcdc382778e1e0911fd186bf4161"}
