{"activated_at":"2026-10-02T08:59:01Z","activated_from_proposal_id":null,"candidate_head_sha":"9b5c693b35d73949572a6c47249737498744eb4c","effect_lineage_id":"lin-b757e1f32e673b17e891814dda444e7b182d4a7206d2bd23","expected_revision":3,"external_dispatch_key":"dispatch-83750e513f104f10351f349a86515f6a14772a80","operation_generation_at_activation":1,"operation_id_at_activation":"op-152cf56ab312b25eebb80801734999a882e6fe4c","predecessor_semantic_effect_key":null,"role":"qa","schema_version":"ai-sdlc.effect-lineage-member/v1","semantic_effect_key":"6d3edfcfa28ca16e750655db8d1cd1da0e09850f16a7e12c727c9ca3cb1a6fac","stage":"verification","task_identity":"vertical:verification:9b5c693b35d73949572a6c47249737498744eb4c","trusted_context_digest":"b9f42a25370045b50146b5584c87e197f2b047d5081e14ddbfd10a140663ec63"}
