{"activated_at":"2026-09-27T07:31:55Z","activated_from_proposal_id":null,"candidate_head_sha":"7de54e4977508ef4e6928db9cbcf007c4c96081f","effect_lineage_id":"lin-5dc2afe38f5839b9d492e743652a85bb719fde807addfbdb","expected_revision":3,"external_dispatch_key":"dispatch-6037a83db61340675df6ea4029da057ebde79d30","operation_generation_at_activation":1,"operation_id_at_activation":"op-aa816e0b24f9fd2cd67ad50672832ed610a97168","predecessor_semantic_effect_key":null,"role":"qa","schema_version":"ai-sdlc.effect-lineage-member/v1","semantic_effect_key":"5cfff90621e2d150df5762c862e556e051676fbe9ec0610298a32ab67baf51c2","stage":"verification","task_identity":"vertical:verification:7de54e4977508ef4e6928db9cbcf007c4c96081f","trusted_context_digest":"b66093633eaf8ab4616a2d9f0a710c5a2552789c97e4c7b0fe9c661b966c33ac"}
