{"activated_at":"2026-09-26T14:58:48Z","activated_from_proposal_id":null,"candidate_head_sha":"5fa3ceb6c8ace63915a1ff912d5344e239965bfe","effect_lineage_id":"lin-69797476fa7d37fc1e34f6e184722350644ad94b0dd20f2c","expected_revision":3,"external_dispatch_key":"dispatch-c7a6f97110997f56bd6d141317fcfe2a59a9d78c","operation_generation_at_activation":1,"operation_id_at_activation":"op-b98c48d8a34a2108ae4d83f8b10467d9311f0a27","predecessor_semantic_effect_key":null,"role":"qa","schema_version":"ai-sdlc.effect-lineage-member/v1","semantic_effect_key":"dcc880cc66c39432e8a8ebd426a2fc16591e1a198afa8fbda14ed412306a72a3","stage":"verification","task_identity":"vertical:verification:5fa3ceb6c8ace63915a1ff912d5344e239965bfe","trusted_context_digest":"3d3e0050ed5c42edee2470e1bea2dfb5e35347e7cf1723041f98dd2d4ad25c77"}
