{"activated_at":"2026-09-25T01:54:14Z","activated_from_proposal_id":null,"candidate_head_sha":"758d015a096e4282734fff7ec6554a1a43bb76e2","effect_lineage_id":"lin-1bcc8963f5b868cb1640b322ecd2949b9a56058a6b152629","expected_revision":1,"external_dispatch_key":"dispatch-019708556a0acd072fea70b562b6214d3c3831c8","operation_generation_at_activation":0,"operation_id_at_activation":"op-a571465e14f372c9a275591ffdfd36d618bb33dc","predecessor_semantic_effect_key":null,"role":"reviewer","schema_version":"ai-sdlc.effect-lineage-member/v1","semantic_effect_key":"56b8975751710f816ab15a545054e1a7512f205d7a8f64c6a73e228381995420","stage":"code-review","task_identity":"vertical:code-review:758d015a096e4282734fff7ec6554a1a43bb76e2","trusted_context_digest":"67819b2a5b7663d657c8ac52da92dc2ad04e04ba9a8958df68911c391dd32705"}
