{"activated_at":"2026-09-26T03:28:31Z","activated_from_proposal_id":null,"candidate_head_sha":"43690c8f11bd4e106c5e3bcfb9701be1824f9e8a","effect_lineage_id":"lin-c4fdd40a6c05c5923ac1e28fbfeafcac322c6668ad091415","expected_revision":1,"external_dispatch_key":"dispatch-d96d3cb82eaf214d347509b687fe8bd81b86fe3f","operation_generation_at_activation":0,"operation_id_at_activation":"op-3a6b6a776b24e9a277247782816a27f1b2c12694","predecessor_semantic_effect_key":null,"role":"reviewer","schema_version":"ai-sdlc.effect-lineage-member/v1","semantic_effect_key":"80c908650f728899b937206d4230adb4fda0de072ffc9e1d5aa78a09fdcf292d","stage":"code-review","task_identity":"vertical:code-review:43690c8f11bd4e106c5e3bcfb9701be1824f9e8a","trusted_context_digest":"e453d8bfe372b38898933d7ffb35a6b1da5349d47e600e5136e66bb2fcd270b2"}
