{"activated_at":"2026-10-02T08:10:08Z","activated_from_proposal_id":null,"candidate_head_sha":"7b030ee558c50ca0dcafdfe82b271fe072de506f","effect_lineage_id":"lin-3300fb16a8d72ddd565d3268ed417a85db537c1d18cc848b","expected_revision":1,"external_dispatch_key":"dispatch-ee4e057ee6377d455c71282f4784953b2270780f","operation_generation_at_activation":0,"operation_id_at_activation":"op-e6d988f2dc88f021a3a39b3a225d7beca9cf4e67","predecessor_semantic_effect_key":null,"role":"reviewer","schema_version":"ai-sdlc.effect-lineage-member/v1","semantic_effect_key":"148b7e71e226c5826d3f18d1281028f5bc165367a7ee7f2dc1978b9d20ff1981","stage":"code-review","task_identity":"vertical:code-review:7b030ee558c50ca0dcafdfe82b271fe072de506f","trusted_context_digest":"6178819ce2346a24872b0c82f93a917c9eb434ba69ad28dad53df4067744ef77"}
