{"activated_at":"2026-10-02T15:10:25Z","activated_from_proposal_id":null,"candidate_head_sha":"b8c8b20f425d0d73ebe718f6e785430b4accf71d","effect_lineage_id":"lin-1e177905845da46c33fe2180d0cf3f47451fd43ae566c672","expected_revision":1,"external_dispatch_key":"dispatch-16faec10de1b89a9a8b73970829b7f3c8baafef1","operation_generation_at_activation":0,"operation_id_at_activation":"op-c95b421d77f7999baf82c926c41313402834d86c","predecessor_semantic_effect_key":null,"role":"reviewer","schema_version":"ai-sdlc.effect-lineage-member/v1","semantic_effect_key":"3dc4f53c0f023b5283a16bd26178061d9d7104a2994b3f16784ddee404844678","stage":"code-review","task_identity":"vertical:code-review:b8c8b20f425d0d73ebe718f6e785430b4accf71d","trusted_context_digest":"36909c43e91ad83c51f0465ac3dfc9f0dbc24f710119ceeb85e561ff1bd37065"}
