{"activated_at":"2026-09-26T12:02:35Z","activated_from_proposal_id":null,"candidate_head_sha":"b5c28a65b72ed6c3870bc1ddffbda28d75522dc6","effect_lineage_id":"lin-2940b2b42cf053e0d5e8bebd80d395d5bf811691d56f647c","expected_revision":1,"external_dispatch_key":"dispatch-b7c68f17159ba72d75e55cf90a120676381bc983","operation_generation_at_activation":0,"operation_id_at_activation":"op-2192427a991fe08afdf524e2653d09ec10fe7857","predecessor_semantic_effect_key":null,"role":"reviewer","schema_version":"ai-sdlc.effect-lineage-member/v1","semantic_effect_key":"35b8dc9314a00af28352dc8869a2c6d63b4fe7bde5848c45e8bacad7bf2a62ad","stage":"code-review","task_identity":"vertical:code-review:b5c28a65b72ed6c3870bc1ddffbda28d75522dc6","trusted_context_digest":"b1f563e2ba70ff7814571ec497eacc3ea0afb927aa79c894723a51258806c3a3"}
